I finally got the the starting line last night, now I'll continue! I'll get some node code working to speak to a single sensor and then I'll have it speaking to multiple ones...

Adding a config file so that the code knows which IPs to poll..

hmm... major re-write in the afternoon, moved to a proper object-oriented javascript approach as hacking it to death wasn't working.

Runs nicely now.

02:06:23.532892 IP 10.0.0.4.20108 > 10.0.0.69.8234: UDP, length 9
02:06:23.684222 IP 10.0.0.69.8234 > 10.0.0.4.20108: UDP, length 1
02:06:23.739784 IP 10.0.0.4.20108 > 10.0.0.69.8234: UDP, length 9
02:06:23.745265 IP 10.0.0.69.60908 > 10.0.0.1.9000: UDP, length 16
02:06:23.749675 IP 10.0.0.1 > 10.0.0.69: ICMP 10.0.0.1 udp port 9000 unreachable, length 52
02:06:23.890092 IP 10.0.0.69.8234 > 10.0.0.4.20108: UDP, length 1
02:06:23.928255 ARP, Request who-has 10.0.0.3 tell 10.0.0.69, length 28
02:06:23.945640 IP 10.0.0.4.20108 > 10.0.0.69.8234: UDP, length 9
02:06:24.095954 IP 10.0.0.69.8234 > 10.0.0.4.20108: UDP, length 1
02:06:24.151527 IP 10.0.0.4.20108 > 10.0.0.69.8234: UDP, length 9
02:06:24.301709 IP 10.0.0.69.8234 > 10.0.0.4.20108: UDP, length 1
02:06:24.356409 IP 10.0.0.4.20108 > 10.0.0.69.8234: UDP, length 9
02:06:24.506647 IP 10.0.0.69.8234 > 10.0.0.4.20108: UDP, length 1
02:06:24.562287 IP 10.0.0.4.20108 > 10.0.0.69.8234: UDP, length 9
02:06:24.711423 IP 10.0.0.69.8234 > 10.0.0.4.20108: UDP, length 1
02:06:24.766169 IP 10.0.0.4.20108 > 10.0.0.69.8234: UDP, length 9
02:06:24.917257 IP 10.0.0.69.8234 > 10.0.0.4.20108: UDP, length 1
02:06:24.972039 IP 10.0.0.4.20108 > 10.0.0.69.8234: UDP, length 9
02:06:25.021715 ARP, Request who-has 10.0.0.3 tell 10.0.0.69, length 28
02:06:25.126458 IP 10.0.0.69.8234 > 10.0.0.4.20108: UDP, length 1
02:06:25.181919 IP 10.0.0.4.20108 > 10.0.0.69.8234: UDP, length 9
02:06:25.331924 IP 10.0.0.69.8234 > 10.0.0.4.20108: UDP, length 1
02:06:25.386780 IP 10.0.0.4.20108 > 10.0.0.69.8234: UDP, length 9
02:06:25.537892 IP 10.0.0.69.8234 > 10.0.0.4.20108: UDP, length 1
02:06:25.592654 IP 10.0.0.4.20108 > 10.0.0.69.8234: UDP, length 9
02:06:25.743748 IP 10.0.0.69.8234 > 10.0.0.4.20108: UDP, length 1
02:06:25.798537 IP 10.0.0.4.20108 > 10.0.0.69.8234: UDP, length 9
02:06:25.948891 IP 10.0.0.69.8234 > 10.0.0.4.20108: UDP, length 1
02:06:26.004405 IP 10.0.0.4.20108 > 10.0.0.69.8234: UDP, length 9
02:06:26.021998 ARP, Request who-has 10.0.0.3 tell 10.0.0.69, length 28
02:06:26.171421 IP 10.0.0.69.8234 > 10.0.0.4.20108: UDP, length 1
02:06:26.226270 IP 10.0.0.4.20108 > 10.0.0.69.8234: UDP, length 9
02:06:26.376486 IP 10.0.0.69.8234 > 10.0.0.4.20108: UDP, length 1
02:06:26.432172 IP 10.0.0.4.20108 > 10.0.0.69.8234: UDP, length 9
02:06:26.582085 IP 10.0.0.69.8234 > 10.0.0.4.20108: UDP, length 1
02:06:26.637061 IP 10.0.0.4.20108 > 10.0.0.69.8234: UDP, length 9
02:06:26.788049 IP 10.0.0.69.8234 > 10.0.0.4.20108: UDP, length 1
02:06:26.842902 IP 10.0.0.4.20108 > 10.0.0.69.8234: UDP, length 9
02:06:26.994092 IP 10.0.0.69.8234 > 10.0.0.4.20108: UDP, length 1
02:06:27.025886 ARP, Request who-has 10.0.0.3 tell 10.0.0.69, length 28
02:06:27.048774 IP 10.0.0.4.20108 > 10.0.0.69.8234: UDP, length 9
02:06:27.053533 IP 10.0.0.69.60908 > 10.0.0.1.9000: UDP, length 16
02:06:27.054978 IP 10.0.0.1 > 10.0.0.69: ICMP 10.0.0.1 udp port 9000 unreachable, length 52
02:06:27.199696 IP 10.0.0.69.8234 > 10.0.0.4.20108: UDP, length 1
02:06:27.254670 IP 10.0.0.4.20108 > 10.0.0.69.8234: UDP, length 9

